{
  "version": 1,
  "kind": "puzzle",
  "puzzle_id": null,
  "hotbar": null,
  "player": {
    "x": 0.5,
    "y": 2.78,
    "z": 10.5,
    "yaw": 0.0,
    "pitch": -0.15,
    "flying": false
  },
  "sun": {
    "direction": [
      0.85,
      0.25,
      0.15
    ],
    "illuminance": 6500,
    "color_temperature": 3200,
    "skybox_brightness": 1000
  },
  "ambient": {
    "color": [
      0.95,
      0.88,
      0.82
    ],
    "brightness": 520
  }
}
